{
  "contract_id": "inlumen.generic-node@2",
  "version": "2",
  "inputs": [
    {
      "name": "transcript",
      "filename": "transcript.json",
      "representation": "file",
      "kind": "json",
      "format": "json",
      "schema": {
        "type": "object",
        "required": [
          "transcript"
        ],
        "properties": {
          "transcript": {
            "type": "string"
          }
        }
      },
      "source_node": "transcribe",
      "connection_id": "transcribe.output->anonymize.input",
      "target_port": "input"
    }
  ],
  "outputs": [
    {
      "name": "anonymized_transcript",
      "filename": "anonymized.json",
      "representation": "file",
      "kind": "json",
      "format": "json",
      "schema": {
        "type": "object",
        "required": [
          "transcript"
        ],
        "properties": {
          "transcript": {
            "type": "string"
          }
        }
      }
    }
  ]
}
